{
  "$schema": "competitor-research-package/v1",
  "runId": "run-wedding-live",
  "prd": {
    "prdId": "prd.wedding-invitation.v1",
    "title": "Mobile wedding invitation builder",
    "domain": "wedding invitation",
    "payloadHash": "sha256:4cc2df97dcdd2433c824cf4943af883176c2d657ded8e298758a3d0a41888740"
  },
  "scope": {
    "problem": "Couples without design skills need to create and share a polished mobile wedding invitation page (date, venue, RSVP, gallery) quickly and affordably.",
    "audience": "Engaged couples in their 20s-30s planning a wedding, primarily on mobile, in Korea and similar markets.",
    "jobs": [
      "Create an invitation from a template and personalize text, photos, and theme",
      "Share the invitation link via messaging apps",
      "Collect RSVP responses and congratulatory messages",
      "Show venue location, directions, and account transfer info for gifts"
    ],
    "featureScope": [
      "feat.templates: Template gallery - pre-designed invitation templates the user can pick and customize (p0)",
      "feat.rsvp: RSVP collection - guests submit attendance, headcount, and meal preference (p0)",
      "feat.gallery: Photo gallery - couple photo gallery with lightbox viewing (p1)",
      "feat.map: Venue map and directions - embedded map, transit guidance, and parking info (p0)",
      "feat.gift: Gift account info - bank account reveal for congratulatory money, per side of the family (p1)"
    ]
  },
  "competitors": [
    {
      "competitorId": "comp.barunson-mcard",
      "name": "Barunson Mcard (바른손카드 모바일청첩장)",
      "url": "https://mcard.barunsoncard.com/",
      "rationale": {
        "sharedProblem": "Lets couples without design skills produce a polished mobile wedding invitation page quickly; marketed as free/unlimited mobile invitation creation, directly addressing the affordability angle of the PRD problem.",
        "sharedAudience": "Korean engaged couples in their 20s-30s preparing weddings on mobile; Barunson is Korea's best-known wedding invitation brand and its Mcard product targets exactly this segment.",
        "sharedJobs": [
          "Create an invitation from a template and personalize text, photos, and theme",
          "Share the invitation link via messaging apps (link copy and QR code from My Page)",
          "Show venue location, directions, and account transfer info for gifts (약도/map image, 축의금 계좌번호 reveal)"
        ],
        "featureOverlap": [
          "feat.templates - large mobile invitation template gallery (Product/MobileInvitationList, Product/Detail pages)",
          "feat.gallery - couple photo gallery within the invitation page",
          "feat.map - venue map/directions section (약도 image, QR usage)",
          "feat.gift - congratulatory money account-number section",
          "feat.rsvp - attendance-check function on invitation pages"
        ]
      },
      "accessLimitations": [
        "Building or previewing a personalized invitation requires Barunson account signup/login; My Page features are not publicly crawlable",
        "Some feature explanations live in FAQ pages split across desktop (www.barunsoncard.com) and mobile (m.barunsoncard.com) domains, and parts are rendered as images rather than quotable text",
        "Template detail pages show sample invitations; live customer invitations are private links"
      ]
    },
    {
      "competitorId": "comp.theirmood",
      "name": "데어무드 (Theirmood)",
      "url": "https://theirmood.com/",
      "rationale": {
        "sharedProblem": "Couples without design skills need a polished, shareable mobile wedding invitation page quickly and affordably; Theirmood sells exactly this as a flat-priced Korean SaaS (~19,800 KRW) with free draft creation and unlimited editing until the wedding date.",
        "sharedAudience": "Engaged Korean couples in their 20s-30s planning weddings on mobile, sharing invitations via KakaoTalk — the same primary audience and market as the PRD.",
        "sharedJobs": [
          "Create a designed mobile invitation page from templates without design skills",
          "Show wedding date, venue map, and directions automatically from the venue address",
          "Collect RSVPs with attendance tracking, KakaoTalk notifications, and Excel export",
          "Display a photo gallery (up to 100 photos, multiple layouts)",
          "Share the invitation link with guests via mobile messaging"
        ],
        "featureOverlap": [
          "56 design templates with animation effects",
          "RSVP system with automated attendance tracking",
          "Photo gallery with grid/swipe/thumbnail layouts",
          "Auto-generated venue map, directions, and transport info",
          "Guestbook and guest photo upload (QR-based 'snap') features",
          "Flat affordable one-time pricing, free draft before purchase"
        ]
      },
      "accessLimitations": [
        "Editing dashboard and management features require sign-up/purchase; homepage marketing content was verified, not the logged-in editor",
        "Some review counts on the homepage render obscured (e.g. '00+') without JS"
      ]
    },
    {
      "competitorId": "comp.yeonseo",
      "name": "연서 (Yeonseo)",
      "url": "https://www.yeonseo.kr/",
      "rationale": {
        "sharedProblem": "Couples want a polished mobile invitation without hiring a designer; Yeonseo advertises creating and sharing a complete mobile invitation in about 5 minutes for a single low one-time price (₩9,800 for one year).",
        "sharedAudience": "Korean engaged couples in their 20s-30s, mobile-first, sharing invitations through KakaoTalk — matching the PRD's audience and market.",
        "sharedJobs": [
          "Build a template-based mobile invitation page quickly with no design skills",
          "Present date, venue, and directions (Kakao/Naver/Tmap map integration)",
          "Collect RSVPs and congratulatory guestbook messages from guests",
          "Show a wedding photo gallery (up to 30 photos, slideshow or grid)",
          "Share via KakaoTalk card, short URL, and QR code"
        ],
        "featureOverlap": [
          "Design templates (classical, modern, minimal, vintage)",
          "RSVP and guestbook",
          "Photo gallery with slideshow/grid display",
          "Venue map and transit guidance integrations",
          "Bank account info display with one-click copy",
          "KakaoTalk/URL/QR sharing"
        ]
      },
      "accessLimitations": [
        "Invitation editor and RSVP management require account sign-up; only public marketing pages were verified",
        "Site content is Korean-only"
      ]
    }
  ],
  "references": [
    {
      "referenceId": "ref.kakao-share-docs",
      "title": "Kakao Developers — Kakao Talk Share & Message Template docs",
      "url": "https://developers.kakao.com/docs/en/kakaotalk-share/common",
      "kind": "official_docs",
      "whyRelevant": "Official spec for the 'share invitation link via KakaoTalk' task: defines the share flow and the message-template structure (image + text + up to 2 buttons) the invitation share card must fit."
    },
    {
      "referenceId": "ref.kakao-maps-js",
      "title": "Kakao Maps JavaScript Web API (apis.map.kakao.com)",
      "url": "https://apis.map.kakao.com/web/",
      "kind": "official_docs",
      "whyRelevant": "Official docs for the embedded venue-location map: free quota, markers for the venue pin, and HTML custom overlays usable for a styled venue label/directions bubble."
    },
    {
      "referenceId": "ref.blissandbone-rsvp",
      "title": "Bliss & Bone — Wedding Website RSVP: Setup, Etiquette & Tracking Guide",
      "url": "https://blissandbone.com/resources/rsvp-wedding-websites",
      "kind": "article",
      "whyRelevant": "Domain-specific RSVP UX conventions: which questions to ask (attendance, guest count, meal), form length targets, deadlines, and host-side response tracking — maps directly to the RSVP collection task."
    },
    {
      "referenceId": "ref.nngroup-web-form-design",
      "title": "Nielsen Norman Group — Website Forms Usability",
      "url": "https://www.nngroup.com/articles/web-form-design/",
      "kind": "article",
      "whyRelevant": "General form-usability heuristics (single column, minimal fields, label placement) that apply to the mobile RSVP form and the invitation text-personalization editor."
    },
    {
      "referenceId": "ref.collectui",
      "title": "Collect UI — Daily User Interface Inspiration",
      "url": "https://collectui.com/",
      "kind": "pattern_gallery",
      "whyRelevant": "Free-to-browse UI shot gallery (categories browsable without login) usable for visual references for card/gallery layouts, event pages, and form styling; a free substitute for the off-limits paid libraries."
    }
  ],
  "featureMatrix": [
    {
      "featureId": "feat.templates",
      "prdFeature": "Template gallery",
      "perCompetitor": {
        "comp.barunson-mcard": {
          "status": "observed",
          "cardIds": [
            "card.comp.barunson-mcard.templates-1"
          ]
        },
        "comp.theirmood": {
          "status": "unknown",
          "cardIds": []
        },
        "comp.yeonseo": {
          "status": "observed",
          "cardIds": [
            "card.comp-yeonseo.templates-1"
          ]
        }
      },
      "ideas": [
        "Offer a live per-template sample preview (Barunson embeds a /preview/{id} iframe on each template detail page) so users can judge designs before signing up — recognition rather than recall.",
        "Prefill editor fields from the chosen template and defer optional sections, per NN/g guidance to remove fields that can be derived, deferred, or omitted.",
        "Differentiate on curation quality over raw count: Barunson markets '100여종의 스킨' via image-heavy pages; a smaller, well-tagged gallery with fast lightweight previews could feel better on mobile."
      ]
    },